<?xml version="1.0" encoding="UTF-8"?>
<vf:BusinessTransaction xmlns:vf="https://w3id.org/valueflows/ont/vf#"
                        xmlns:xsi="http://www.w3.org/2001/XMLSchema-instance"
                        xsi:schemaLocation="https://w3id.org/valueflows/ont/vf# ../Shift%20Left/ISO%2015944/valueflows_schema.xsd">
  <vf:transactionId>TX-2026-0803-001</vf:transactionId>
  <vf:issueDate>2026-08-03T16:30:00Z</vf:issueDate>
  <vf:governingJurisdiction>UNCITRAL CISG / Colombia</vf:governingJurisdiction>
  
  <vf:agreement>
    <vf:id>AGR-2026-DFRNT-01</vf:id>
    <vf:name>Contrato de Suministro de Licencias y Auditoría de Grafo</vf:name>
    <vf:created>2026-08-03T10:00:00Z</vf:created>
    <vf:specifiedIn>https://dfrnt.org/contracts/AGR-2026-DFRNT-01.pdf</vf:specifiedIn>
    <vf:buyer>
      <vf:id>AGT-BUYER-001</vf:id>
      <vf:name>Empresa Auditora de Colombia S.A.S.</vf:name>
      <vf:agentType>Organization</vf:agentType>
      <vf:isRelatedParty>true</vf:isRelatedParty>
      <vf:relatedPartyType>Subsidiary</vf:relatedPartyType>
      <vf:primaryLocation>Bogotá, Colombia</vf:primaryLocation>
    </vf:buyer>
    <vf:seller>
      <vf:id>AGT-SELLER-001</vf:id>
      <vf:name>DFRNT Systems Corp</vf:name>
      <vf:agentType>Organization</vf:agentType>
      <vf:isRelatedParty>true</vf:isRelatedParty>
      <vf:relatedPartyType>ParentCompany</vf:relatedPartyType>
      <vf:primaryLocation>Stockholm, Sweden</vf:primaryLocation>
    </vf:seller>
    <vf:note>Contrato marco de servicios y transferencia de derechos bajo ontología REA / ISO 15944-4</vf:note>
  </vf:agreement>

  <vf:agents>
    <vf:agent>
      <vf:id>AGT-BUYER-001</vf:id>
      <vf:name>Empresa Auditora de Colombia S.A.S.</vf:name>
      <vf:agentType>Organization</vf:agentType>
      <vf:isRelatedParty>true</vf:isRelatedParty>
      <vf:relatedPartyType>Subsidiary</vf:relatedPartyType>
      <vf:primaryLocation>Bogotá, Colombia</vf:primaryLocation>
      <vf:classifiedAs>https://schema.org/Corporation</vf:classifiedAs>
    </vf:agent>
    <vf:agent>
      <vf:id>AGT-SELLER-001</vf:id>
      <vf:name>DFRNT Systems Corp</vf:name>
      <vf:agentType>Organization</vf:agentType>
      <vf:isRelatedParty>true</vf:isRelatedParty>
      <vf:relatedPartyType>ParentCompany</vf:relatedPartyType>
      <vf:primaryLocation>Stockholm, Sweden</vf:primaryLocation>
      <vf:classifiedAs>https://schema.org/Corporation</vf:classifiedAs>
    </vf:agent>
  </vf:agents>

  <vf:resourceSpecifications>
    <vf:resourceSpecification>
      <vf:id>RS-DFRNT-NODE</vf:id>
      <vf:name>Licencia DFRNT Node Enterprise</vf:name>
      <vf:defaultUnit>UN</vf:defaultUnit>
      <vf:classifiedAs>https://w3id.org/valueflows/ont/vf#SoftwareResource</vf:classifiedAs>
    </vf:resourceSpecification>
  </vf:resourceSpecifications>

  <vf:commitments>
    <vf:commitment>
      <vf:id>COM-001-DELIVERY</vf:id>
      <vf:action>deliver-service</vf:action>
      <vf:provider>AGT-SELLER-001</vf:provider>
      <vf:receiver>AGT-BUYER-001</vf:receiver>
      <vf:resourceConformsTo>RS-DFRNT-NODE</vf:resourceConformsTo>
      <vf:resourceQuantity>
        <vf:value>1</vf:value>
        <vf:unitSymbol>UN</vf:unitSymbol>
      </vf:resourceQuantity>
      <vf:due>2026-08-15T23:59:59Z</vf:due>
      <vf:clauseOf>AGR-2026-DFRNT-01</vf:clauseOf>
      <vf:reciprocalWith>COM-002-PAYMENT</vf:reciprocalWith>
      <vf:state>scheduled</vf:state>
      <vf:note>Promesa de despliegue de nodo de auditoría en la nube</vf:note>
    </vf:commitment>

    <vf:commitment>
      <vf:id>COM-002-PAYMENT</vf:id>
      <vf:action>pay</vf:action>
      <vf:provider>AGT-BUYER-001</vf:provider>
      <vf:receiver>AGT-SELLER-001</vf:receiver>
      <vf:resourceConformsTo>https://w3id.org/valueflows/ont/vf#Currency-USD</vf:resourceConformsTo>
      <vf:resourceQuantity>
        <vf:value>15000.00</vf:value>
        <vf:unitSymbol>USD</vf:unitSymbol>
      </vf:resourceQuantity>
      <vf:due>2026-08-30T23:59:59Z</vf:due>
      <vf:clauseOf>AGR-2026-DFRNT-01</vf:clauseOf>
      <vf:reciprocalWith>COM-001-DELIVERY</vf:reciprocalWith>
      <vf:state>scheduled</vf:state>
      <vf:note>Pago contractual acordado a 15 días tras entrega</vf:note>
    </vf:commitment>
  </vf:commitments>

  <vf:reciprocities>
    <vf:reciprocity>
      <vf:id>REC-001</vf:id>
      <vf:incrementCommitmentRef>COM-001-DELIVERY</vf:incrementCommitmentRef>
      <vf:decrementCommitmentRef>COM-002-PAYMENT</vf:decrementCommitmentRef>
      <vf:note>Dualidad ontológica REA: Entrega de Licencia &lt;-&gt; Pago USD</vf:note>
    </vf:reciprocity>
  </vf:reciprocities>

</vf:BusinessTransaction>
